id,author,availability_status,created_at,description,isbn,publication_year,publisher,title,updated_at
1eabc472-633f-43bc-9495-452555aef333,"Erich Gamma, Richard Helm, Ralph Johnson, John Vlissides",BORROWED,2026-04-19 11:37:22.837523,"The definitive book on design patterns in object-oriented programming, known as the 'Gang of Four' book.",978-0-20-163361-0,1994,Addison-Wesley,Design Patterns: Elements of Reusable Object-Oriented Software,2026-04-19 11:37:22.837523
33cd79cd-be02-4b33-adc9-40f6dcdf4139,"Thomas H. Cormen, Charles E. Leiserson, Ronald L. Rivest, Clifford Stein",AVAILABLE,2026-04-19 11:37:22.842329,"A comprehensive introduction to the modern study of computer algorithms, widely used in computer science courses.",978-0-26-203384-8,2009,MIT Press,Introduction to Algorithms,2026-04-19 11:37:22.842329
061cacb6-6ba2-4f8d-b4f7-4262cae8e2a0,"David Thomas, Andrew Hunt",AVAILABLE,2026-04-19 11:37:22.846464,A practical guide to software development that focuses on being a pragmatic programmer through tips and techniques.,978-0-13-595705-9,2019,Addison-Wesley,The Pragmatic Programmer: Your Journey to Mastery,2026-04-19 11:37:22.846464
ccda2b02-7cab-48d7-8eff-f30ebe12f0a8,Alex Xu,AVAILABLE,2026-04-19 11:37:22.850413,A comprehensive guide to system design interviews with real-world examples and practical solutions.,978-1-73-671118-6,2020,ByteByteGo,System Design Interview: An Insider's Guide,2026-04-19 11:37:22.850413
a8826c01-5b2c-4043-95d5-4e22a5ef535b,Robert C. Martin,RESERVED,2026-04-19 11:37:22.762893,"A comprehensive guide to writing clean, readable, and maintainable code with practical examples and best practices.",978-0-13-235088-4,2008,Prentice Hall,Clean Code: A Handbook of Agile Software Craftsmanship,2026-04-19 12:18:36.569473
